{
  "schema_version": "1.0",
  "document_id": "doc-example-001",
  "source": {"type": "image", "filename": "sample.png"},
  "text": "Attendance: 85%\nMarks: 90",
  "metadata": {"page_count": 1, "image_width": 1200, "image_height": 800, "image_format": "PNG", "ocr_engine": "tesseract", "preprocessing_operations": ["exif_orientation", "grayscale", "autocontrast", "median_denoise", "contrast_adjustment"], "processing_duration_ms": 46.2},
  "warnings": []
}
